{
  "id": "ngorongoro",
  "title": "Ngorongoro Conservation Area",
  "old_title": "Ngorongoro National Park",
  "summary": null,
  "body": "Discover the Majestic Ngorongoro Crater\nThe Ngorongoro Crater, a highlight of the Ngorongoro Conservation Area, is a breathtaking natural wonder formed two to three million years ago from the collapse of a massive volcano. This geological marvel has since evolved into a unique ecosystem with a rich tapestry of vegetation, making it a prime spot for ecological and wildlife observations.\n\nToday, the crater boasts the highest density of wildlife in Africa. Its 20-kilometer-wide and 600-meter-deep basin shelters zebras, buffaloes, warthogs, baboons, elephants, flamingos, ostriches, and hippos. Predators such as lions, hyenas, jackals, cheetahs, and leopards are also prevalent, contributing to its reputation as a top safari destination.\nThe Ngorongoro Crater is particularly famous for offering visitors the chance to see the Big Five—buffalo, elephant, leopard, lion, and rhino—all within its expansive and picturesque landscape. The vistas from the crater rim are as stunning as the diverse wildlife that inhabits the crater floor.\n\nExperience the Maasai Culture\nA visit to the Ngorongoro Conservation Area can also include a culturally enriching encounter with the Maasai tribe. The Maasai are permitted to graze their livestock within the conservation area, maintaining their traditional way of life amid the natural beauty of their surroundings.\nFor those interested in deepening their understanding of the Maasai’s rich cultural heritage and rituals, booking a Maasai Tour is highly recommended. This immersive experience provides an intimate look at the vibrant culture of one of Africa's most iconic communities, complementing the natural wonders of the Ngorongoro Crater with a human touch.",
  "facts_intro": "The Ngorongoro Crater, recognized as one of Africa's natural wonders, is a premier wildlife sanctuary famed for its dense animal populations and stunning geological features. This unique natural amphitheater is a must-visit.",
  "wildlife": [
    {
      "name": "Lions",
      "note": "Known for their majesty and strength, are a common and thrilling sight within the crater."
    },
    {
      "name": "Cheetahs",
      "note": "These swift predators are frequently observed across the crater floor."
    },
    {
      "name": "Leopards",
      "note": "Elusive and powerful, leopards add an air of mystery to the crater's diverse ecosystem."
    },
    {
      "name": "Wildebeest",
      "note": "With substantial numbers, these animals are central to the crater's ecological dynamics."
    },
    {
      "name": "Zebras",
      "note": "Over 200,000 zebras add striking visuals to the landscape."
    },
    {
      "name": "Gazelles",
      "note": "Numerous gazelles populate the area, playing a crucial role in the food chain."
    },
    {
      "name": "Rhinos",
      "note": "As a key member of the Big Five, the endangered rhino is a treasured sighting in the crater."
    },
    {
      "name": "Elephants",
      "note": "These gentle giants roam freely, adding to the grandeur of the environment."
    },
    {
      "name": "Crocodiles and Hippos",
      "note": "Both are often seen in the crater’s waters, with hippos prominently visible at Ngoitokitok Spring."
    }
  ],
  "noteworthy": [
    {
      "name": "Volcanic Basin",
      "note": "The crater was formed when a giant volcano exploded and collapsed, creating a natural enclosure for an incredibly diverse ecosystem."
    },
    {
      "name": "High Density of Wildlife",
      "note": "The crater is home to the highest density of predators and prey in Africa, offering unparalleled wildlife viewing opportunities."
    },
    {
      "name": "Lush Forests and Lakes",
      "note": "The environment ranges from highland forest to grassland, punctuated with freshwater and alkaline lakes."
    },
    {
      "name": "Endemic Species",
      "note": "The crater supports a variety of endemic species due to its isolated nature."
    },
    {
      "name": "Viewpoints and Vistas",
      "note": "The rim of the crater provides spectacular views of the wildlife and landscapes below, especially breathtaking at sunrise and sunset."
    }
  ],
  "travel_times": [
    "Arusha to Ngorongoro Conservation Area: 3 hours",
    "Ngorongoro Conservation Area to Serengeti National Park: 2 hours’ drive.",
    "Ngorongoro Conservation Area to Lake Manyara: 1 hour drive.",
    "Ngorongoro to Tarangire: 2 hours’ drive"
  ],
  "images": [
    {
      "src": "https://static.wixstatic.com/media/1ac0ef_6179c700dc0548c7a31bccc08e19cf79~mv2.png",
      "alt": "Mazingira Safaris Eco Friendly Safari Logo"
    },
    {
      "src": "https://static.wixstatic.com/media/1ac0ef_ddd29072abc447bfa487d482fe2ea14a~mv2.jpg",
      "alt": "A Black Rhino in the Ngorongoro Crater, a rare site of these allusive and majestic rhino, part of the big 5 in Africa"
    },
    {
      "src": "https://static.wixstatic.com/media/1ac0ef_bb88bb6bfd2e4e7b94f49f04053fae77~mv2.jpg",
      "alt": "The Beautiful view from The Crater Rim"
    },
    {
      "src": "https://static.wixstatic.com/media/3149b4bc73e34b1d91c612cfc3707356.jpg",
      "alt": "Rhinoceros"
    },
    {
      "src": "https://static.wixstatic.com/media/1ac0ef_7cab25c4bcaa4d56a3895e8b25162527~mv2.jpg",
      "alt": "Hyena"
    },
    {
      "src": "https://static.wixstatic.com/media/1ac0ef_60d78ba507a8403bb51c1d35316af1b8~mv2.jpg",
      "alt": "Maasai people walking through the fields in the Ngorongoro region walking towards there home camps"
    },
    {
      "src": "https://static.wixstatic.com/media/1ac0ef_1d703aa0458843bcb4010e4ac6fab61e~mv2.png",
      "alt": "Note Pad"
    },
    {
      "src": "https://static.wixstatic.com/media/1ac0ef_aea9d2521071435aaa49274427b17209~mv2.jpeg",
      "alt": "Tato Logo"
    }
  ],
  "source": "https://www.mazingirasafari.com/ngorogoro-national-park"
}
